{
  "$schema": "http://json-schema.org/draft-07/schema#",
  "title": "Sphinx subject",
  "description": "A subject (what students study) and its units in teaching order. Content picks a unit with \"topic\".",
  "type": "object",
  "required": [
    "title",
    "units"
  ],
  "properties": {
    "$schema": {
      "type": "string"
    },
    "id": {
      "type": "string",
      "description": "Defaults to the folder name. In a teacher's folder, the id of an existing subject (such as \"java\") adds this file's units after that subject's own units."
    },
    "title": {
      "type": "string"
    },
    "kind": {
      "enum": [
        "programming",
        "theory"
      ]
    },
    "language": {
      "enum": [
        "java",
        "c"
      ],
      "description": "The language of the subject's challenges (default java). Create New Challenge writes C templates for a C subject's units."
    },
    "order": {
      "type": "number",
      "description": "Position in the subject switcher."
    },
    "lockPrerequisites": {
      "enum": [
        "off",
        "half",
        "all"
      ],
      "default": "off",
      "description": "Lock this subject's challenges, tests and quizzes until the units they need (\"requires\") are practised: half or all of each unit's challenges solved. Students' sphinx.lockPrerequisites setting can only make it stricter. Lessons and exams are never locked."
    },
    "units": {
      "type": "array",
      "items": {
        "type": "object",
        "required": [
          "key",
          "title"
        ],
        "properties": {
          "key": {
            "type": "string",
            "description": "Used as \"topic\" in challenges, quizzes and lessons. Unique across subjects."
          },
          "title": {
            "type": "string"
          },
          "icon": {
            "type": "string",
            "description": "A codicon name, e.g. \"symbol-numeric\"."
          },
          "aliases": {
            "type": "array",
            "items": {
              "type": "string"
            },
            "description": "Older names still accepted as \"topic\"."
          }
        }
      }
    },
    "translations": {
      "type": "object",
      "additionalProperties": {
        "type": "object",
        "properties": {
          "title": {
            "type": "string"
          },
          "units": {
            "type": "object",
            "additionalProperties": {
              "type": "string"
            }
          }
        }
      }
    }
  }
}
